subreddit,keyword,title,url
depression,death,Chronically depressed. Drawn to death but not suicidal.,https://www.reddit.com/r/depression/comments/1lkibxp/chronically_depressed_drawn_to_death_but_not/
depression,death,How to cope with fiance's death? I just feel numb,https://www.reddit.com/r/depression/comments/1ljiq7o/how_to_cope_with_fiances_death_i_just_feel_numb/
depression,suicide,Thinking of ruining my sobriety and suicide,https://www.reddit.com/r/depression/comments/1lkw478/thinking_of_ruining_my_sobriety_and_suicide/
depression,suicide,I read my suicide notes and it sent me into a spiral,https://www.reddit.com/r/depression/comments/1lkmbwt/i_read_my_suicide_notes_and_it_sent_me_into_a/
depression,broken,[TW: SELFHARM] Just got broken up with for my self harm cuts.,https://www.reddit.com/r/depression/comments/1lklltr/tw_selfharm_just_got_broken_up_with_for_my_self/
depression,broken,Broken Brain,https://www.reddit.com/r/depression/comments/1liz4dc/broken_brain/
depression,dark,My brain keeps falling into that dark hole.,https://www.reddit.com/r/depression/comments/1ljs6x9/my_brain_keeps_falling_into_that_dark_hole/
depression,lost,I’ve never felt so lost,https://www.reddit.com/r/depression/comments/1lktu5e/ive_never_felt_so_lost/
depression,lost,Feeling lost,https://www.reddit.com/r/depression/comments/1lkt5b2/feeling_lost/
depression,lost,"I survived a bone marrow transplant, but now I feel lost.",https://www.reddit.com/r/depression/comments/1lkipf8/i_survived_a_bone_marrow_transplant_but_now_i/
depression,exhausted,"Exhausted and scared: night-time vertigo, weird shapes when I close my eyes, derealization… what is happening to me?",https://www.reddit.com/r/depression/comments/1lkhr4y/exhausted_and_scared_nighttime_vertigo_weird/
depression,panic,Panic Syndrome,https://www.reddit.com/r/depression/comments/1lkolle/panic_syndrome/
depression,panic,"MDD, panic, suicidal ideation",https://www.reddit.com/r/depression/comments/1lj50ws/mdd_panic_suicidal_ideation/
depression,lonely,Lonely,https://www.reddit.com/r/depression/comments/1lkvjed/lonely/
depression,lonely,So fucking lonely,https://www.reddit.com/r/depression/comments/1lkv5u9/so_fucking_lonely/
depression,lonely,"For the first time in my life, I feel lonely.",https://www.reddit.com/r/depression/comments/1lktfsz/for_the_first_time_in_my_life_i_feel_lonely/
depression,lonely,I'm so bored and lonely,https://www.reddit.com/r/depression/comments/1lkmu4l/im_so_bored_and_lonely/
depression,lonely,27m mdd alone and lonely,https://www.reddit.com/r/depression/comments/1ljt24p/27m_mdd_alone_and_lonely/
depression,lonely,Fuck this lonely life,https://www.reddit.com/r/depression/comments/1ljb5q2/fuck_this_lonely_life/
depression,die,"I don't want to die, but I'm too scared to live.",https://www.reddit.com/r/depression/comments/1lkudub/i_dont_want_to_die_but_im_too_scared_to_live/
depression,die,(22M) I just want to die tonight.,https://www.reddit.com/r/depression/comments/1lktnig/22m_i_just_want_to_die_tonight/
depression,die,I don’t want to die,https://www.reddit.com/r/depression/comments/1lksumv/i_dont_want_to_die/
depression,die,"the greatest lie, the one I am the most proud of, is the one I told my loved ones. ""I don't want to die.""",https://www.reddit.com/r/depression/comments/1lkg46s/the_greatest_lie_the_one_i_am_the_most_proud_of/
depression,numb,Numb feeling,https://www.reddit.com/r/depression/comments/1lk2qdq/numb_feeling/
depression,numb,How to cope with fiance's death? I just feel numb,https://www.reddit.com/r/depression/comments/1ljiq7o/how_to_cope_with_fiances_death_i_just_feel_numb/
depression,worthless,I feel empty and I do not feel worthless,https://www.reddit.com/r/depression/comments/1lkurca/i_feel_empty_and_i_do_not_feel_worthless/
depression,worthless,I did not get into a college and I am worthless,https://www.reddit.com/r/depression/comments/1lkbspc/i_did_not_get_into_a_college_and_i_am_worthless/
depression,worthless,Got ditched by a friend on a trip we planned together. I’m feeling worthless and alone.,https://www.reddit.com/r/depression/comments/1lj82us/got_ditched_by_a_friend_on_a_trip_we_planned/
depression,worthless,Sometimes I just get in these moods where I think I'm worthless and I feel like crying.,https://www.reddit.com/r/depression/comments/1litaut/sometimes_i_just_get_in_these_moods_where_i_think/
depression,tired,i have no support system and i'm tired of loving myself.,https://www.reddit.com/r/depression/comments/1lkuk9b/i_have_no_support_system_and_im_tired_of_loving/
depression,tired,I'm dying from tiredness. Please help me. I want to live but I can't go on like this.,https://www.reddit.com/r/depression/comments/1lksxcj/im_dying_from_tiredness_please_help_me_i_want_to/
depression,tired,I'm tired of loathing my own company,https://www.reddit.com/r/depression/comments/1lkflgy/im_tired_of_loathing_my_own_company/
depression,hopeless,Hopelessness waves?,https://www.reddit.com/r/depression/comments/1lild59/hopelessness_waves/
depression,empty,I feel empty and I do not feel worthless,https://www.reddit.com/r/depression/comments/1lkurca/i_feel_empty_and_i_do_not_feel_worthless/
depression,overwhelmed,"Feeling Overwhelmed and Isolated Lately, Looking for Support.",https://www.reddit.com/r/depression/comments/1lkvkki/feeling_overwhelmed_and_isolated_lately_looking/
depression,shaking,I've got a gun and I shaking I want to use on myself so bad,https://www.reddit.com/r/depression/comments/1lilg0i/ive_got_a_gun_and_i_shaking_i_want_to_use_on/
depression,scared,"I don't want to die, but I'm too scared to live.",https://www.reddit.com/r/depression/comments/1lkudub/i_dont_want_to_die_but_im_too_scared_to_live/
depression,scared,I’m not scared to kms anymore,https://www.reddit.com/r/depression/comments/1lksh37/im_not_scared_to_kms_anymore/
depression,scared,Scared about my future,https://www.reddit.com/r/depression/comments/1lkm8k3/scared_about_my_future/
depression,scared,"Exhausted and scared: night-time vertigo, weird shapes when I close my eyes, derealization… what is happening to me?",https://www.reddit.com/r/depression/comments/1lkhr4y/exhausted_and_scared_nighttime_vertigo_weird/
depression,scared,I’m just scared to leave my house one day,https://www.reddit.com/r/depression/comments/1lkgkv0/im_just_scared_to_leave_my_house_one_day/
depression,worried,I need help I am starting to feel depressed and worried,https://www.reddit.com/r/depression/comments/1lkmvwn/i_need_help_i_am_starting_to_feel_depressed_and/
depression,spiraling,Spiraling. I need to die,https://www.reddit.com/r/depression/comments/1ljt579/spiraling_i_need_to_die/
depression,alone,So alone. When is it time to let go?,https://www.reddit.com/r/depression/comments/1lkvuks/so_alone_when_is_it_time_to_let_go/
depression,alone,is here anyone who replies? I do not wanna go through all of this alone.,https://www.reddit.com/r/depression/comments/1lktc80/is_here_anyone_who_replies_i_do_not_wanna_go/
depression,alone,I am completely alone in the world,https://www.reddit.com/r/depression/comments/1lkqwtb/i_am_completely_alone_in_the_world/
depression,alone,Alone,https://www.reddit.com/r/depression/comments/1lknfux/alone/
depression,invisible,The final stage of high functioning depression is invincible but also mostly invisible,https://www.reddit.com/r/depression/comments/1lelluu/the_final_stage_of_high_functioning_depression_is/
depression,unloved,I am coming to peace with the fact that I'll just die unloved and forgotten,https://www.reddit.com/r/depression/comments/1le1d2f/i_am_coming_to_peace_with_the_fact_that_ill_just/
depression,unloved,I feel so unloved,https://www.reddit.com/r/depression/comments/1l9g8yl/i_feel_so_unloved/
depression,abandoned,My wife abandoned our family. I’m fucking breaking and I can’t because my kids need me ore then ever,https://www.reddit.com/r/depression/comments/1lgrd5a/my_wife_abandoned_our_family_im_fucking_breaking/
depression,friendless,I hate being a weirdo for being friendless,https://www.reddit.com/r/depression/comments/1k06rix/i_hate_being_a_weirdo_for_being_friendless/
depression,friendless,"Awkward, Lonely, Friendless, Loser",https://www.reddit.com/r/depression/comments/1j1hnya/awkward_lonely_friendless_loser/
depression,friendless,Hate myself for being a friendless failure,https://www.reddit.com/r/depression/comments/1ii1blm/hate_myself_for_being_a_friendless_failure/
depression,cut,[TW: SELFHARM] Just got broken up with for my self harm cuts.,https://www.reddit.com/r/depression/comments/1lklltr/tw_selfharm_just_got_broken_up_with_for_my_self/
depression,cut,Sometimes i just want to vanish and cut off contact to all my friends,https://www.reddit.com/r/depression/comments/1lj0okt/sometimes_i_just_want_to_vanish_and_cut_off/
depression,kill,I haven’t been eating and don’t care if it kills me,https://www.reddit.com/r/depression/comments/1lkuqmt/i_havent_been_eating_and_dont_care_if_it_kills_me/
depression,kill,Empathy is killing me,https://www.reddit.com/r/depression/comments/1lku44u/empathy_is_killing_me/
depression,kill,i think i'm going to kill myself,https://www.reddit.com/r/depression/comments/1lkt9qu/i_think_im_going_to_kill_myself/
depression,kill,Killing myself would be the most selfish thing to do.,https://www.reddit.com/r/depression/comments/1lkmi4i/killing_myself_would_be_the_most_selfish_thing_to/
depression,kill,I think I might genuinely kill myself at this point,https://www.reddit.com/r/depression/comments/1lk0nm7/i_think_i_might_genuinely_kill_myself_at_this/
depression,kill,Im gonna kill myself today,https://www.reddit.com/r/depression/comments/1lk0efx/im_gonna_kill_myself_today/
depression,gone,Personality gone+Anhedonia+Stupid,https://www.reddit.com/r/depression/comments/1lkhmlk/personality_goneanhedoniastupid/
depression,disappear,"I don't have any goal, and I genuinely just want to disappear",https://www.reddit.com/r/depression/comments/1lk1bxk/i_dont_have_any_goal_and_i_genuinely_just_want_to/
depression,disappear,I want to go to sleep and never wake up again... just disappear,https://www.reddit.com/r/depression/comments/1ljfsma/i_want_to_go_to_sleep_and_never_wake_up_again/
depression,disappear,That feeling of how you could disappear and no one would know,https://www.reddit.com/r/depression/comments/1lilo6n/that_feeling_of_how_you_could_disappear_and_no/
depression,hurt,I’m so fucking hurt,https://www.reddit.com/r/depression/comments/1lkrute/im_so_fucking_hurt/
depression,burnt,"I can't tell if I'm depressed, burnt out, or am heading toward total mental collapse",https://www.reddit.com/r/depression/comments/1ldyx7s/i_cant_tell_if_im_depressed_burnt_out_or_am/
depression,overload,Sadness overload,https://www.reddit.com/r/depression/comments/1idez32/sadness_overload/
depression,shutdown,my brain is shutdown,https://www.reddit.com/r/depression/comments/1kka2hk/my_brain_is_shutdown/
depression,shutdown,Company Shutdown - I have failed my team.,https://www.reddit.com/r/depression/comments/1j554yc/company_shutdown_i_have_failed_my_team/
depression,shutdown,Depression/Anxiety/ADD/Dissociative amnesia/Dissociation/Derealization-cognitive shutdown,https://www.reddit.com/r/depression/comments/1iy9lii/depressionanxietyadddissociative/
depression,shutdown,Anti-depressants caused my liver to almost shutdown. I feel like I’m all out of options,https://www.reddit.com/r/depression/comments/1ir0agr/antidepressants_caused_my_liver_to_almost/
depression,shutdown,I feel like I'm about to shutdown,https://www.reddit.com/r/depression/comments/1i7evqe/i_feel_like_im_about_to_shutdown/
depression,shutdown,My brain has shutdown multiple times. I'm scared.,https://www.reddit.com/r/depression/comments/1g5u1c8/my_brain_has_shutdown_multiple_times_im_scared/
depression,collapse,"I can't tell if I'm depressed, burnt out, or am heading toward total mental collapse",https://www.reddit.com/r/depression/comments/1ldyx7s/i_cant_tell_if_im_depressed_burnt_out_or_am/
depression,collapse,Mental Collapse,https://www.reddit.com/r/depression/comments/1lcpcbb/mental_collapse/
depression,done,I am done,https://www.reddit.com/r/depression/comments/1lku3tw/i_am_done/
depression,done,I don’t know what to even do anymore. This has been fucking my mind up for 2-3 years. I’m done,https://www.reddit.com/r/depression/comments/1lkpbqw/i_dont_know_what_to_even_do_anymore_this_has_been/
depression,done,I'm so done with school,https://www.reddit.com/r/depression/comments/1lkdt1r/im_so_done_with_school/
depression,mute,Going Mute,https://www.reddit.com/r/depression/comments/1lbfedv/going_mute/
depression,mute,Feel like I'm on mute.,https://www.reddit.com/r/depression/comments/1km6kac/feel_like_im_on_mute/
depression,mute,I want to isolate myself and go mute,https://www.reddit.com/r/depression/comments/1k06mrv/i_want_to_isolate_myself_and_go_mute/
depression,mute,Life on mute.,https://www.reddit.com/r/depression/comments/1jxu8rr/life_on_mute/
Anxiety,death,How do I accept the idea of death,https://www.reddit.com/r/Anxiety/comments/1lj8rxl/how_do_i_accept_the_idea_of_death/
Anxiety,death,Anxiety absolutely fucking sucks. T/W Death Anxiety,https://www.reddit.com/r/Anxiety/comments/1lj1wjg/anxiety_absolutely_fucking_sucks_tw_death_anxiety/
Anxiety,death,death anxiety coming yearly,https://www.reddit.com/r/Anxiety/comments/1liy6l9/death_anxiety_coming_yearly/
Anxiety,death,Anxiety about death is seriously starting to ruin my life,https://www.reddit.com/r/Anxiety/comments/1lhw15e/anxiety_about_death_is_seriously_starting_to_ruin/
Anxiety,anxiety,"I got stable from my bipolar disorder, but I still have incredible anxiety",https://www.reddit.com/r/Anxiety/comments/1lkvyvi/i_got_stable_from_my_bipolar_disorder_but_i_still/
Anxiety,anxiety,"Coping with Anxiety During Social Situations , What Has Helped You?",https://www.reddit.com/r/Anxiety/comments/1lkvxve/coping_with_anxiety_during_social_situations_what/
Anxiety,anxiety,Has anyone else ever gotten muscle tension so bad from anxiety that you strained your back?,https://www.reddit.com/r/Anxiety/comments/1lkuzqr/has_anyone_else_ever_gotten_muscle_tension_so_bad/
Anxiety,anxiety,My anxiety has made it where I barely sleep,https://www.reddit.com/r/Anxiety/comments/1lkuyx1/my_anxiety_has_made_it_where_i_barely_sleep/
Anxiety,anxiety,Anxiety and ADHD weird time right now just sharing,https://www.reddit.com/r/Anxiety/comments/1lkuinw/anxiety_and_adhd_weird_time_right_now_just_sharing/
Anxiety,anxiety,Severe Anxiety with constant physical symptoms - mortified of taking Zoloft,https://www.reddit.com/r/Anxiety/comments/1lku5tb/severe_anxiety_with_constant_physical_symptoms/
Anxiety,anxiety,Testing Anxiety to its Limits,https://www.reddit.com/r/Anxiety/comments/1lksyc8/testing_anxiety_to_its_limits/
Anxiety,anxiety,Took 500mg Tryptophan in morning but couldn't see any noticeable effect on my Social anxiety.  Does it take some time?,https://www.reddit.com/r/Anxiety/comments/1lkstqp/took_500mg_tryptophan_in_morning_but_couldnt_see/
Anxiety,anxiety,Did medicine work for your agoraphobia/monophobia/health anxiety/OCD?,https://www.reddit.com/r/Anxiety/comments/1lkskzv/did_medicine_work_for_your/
Anxiety,anxiety,Crazy how fast Anxiety and Panic attacks disappear,https://www.reddit.com/r/Anxiety/comments/1lksiz4/crazy_how_fast_anxiety_and_panic_attacks_disappear/
Anxiety,suicide,Feeling weirdly calm in a scary situation (TW: Suicide Thoughts from the POV of a friend),https://www.reddit.com/r/Anxiety/comments/1lfval4/feeling_weirdly_calm_in_a_scary_situation_tw/
Anxiety,sad,Summertime SAD/Anxiety,https://www.reddit.com/r/Anxiety/comments/1lkbf4b/summertime_sadanxiety/
Anxiety,broken,"Internet “socialization” causes dreadful panic, yet I am ensnared, and helplessly broken",https://www.reddit.com/r/Anxiety/comments/1lc8n6j/internet_socialization_causes_dreadful_panic_yet/
Anxiety,dark,Sensitive gag reflex?? Shot in the dark here..,https://www.reddit.com/r/Anxiety/comments/1ljicho/sensitive_gag_reflex_shot_in_the_dark_here/
Anxiety,dark,Having dark thoughts,https://www.reddit.com/r/Anxiety/comments/1lhnq2y/having_dark_thoughts/
Anxiety,dark,Dark nostalgic type feeling,https://www.reddit.com/r/Anxiety/comments/1lfop5r/dark_nostalgic_type_feeling/
Anxiety,lost,"26, anxious, lost, and trying to rebuild my life. I don’t know where to start",https://www.reddit.com/r/Anxiety/comments/1lkeftr/26_anxious_lost_and_trying_to_rebuild_my_life_i/
Anxiety,exhausted,"Feeling physically exhausted from constant anxiety , is this common?",https://www.reddit.com/r/Anxiety/comments/1lk13p6/feeling_physically_exhausted_from_constant/
Anxiety,exhausted,What do you do on the days where you're feeling hopeless about recovery and just exhausted from dealing with anxiety all the time?,https://www.reddit.com/r/Anxiety/comments/1ljzco1/what_do_you_do_on_the_days_where_youre_feeling/
Anxiety,panic,Anyone else ever feel they are having a panic attack without the “mental aspect” ?,https://www.reddit.com/r/Anxiety/comments/1lkucoc/anyone_else_ever_feel_they_are_having_a_panic/
Anxiety,panic,Is bouts of overthinking a panic attack?,https://www.reddit.com/r/Anxiety/comments/1lksyws/is_bouts_of_overthinking_a_panic_attack/
Anxiety,panic,Crazy how fast Anxiety and Panic attacks disappear,https://www.reddit.com/r/Anxiety/comments/1lksiz4/crazy_how_fast_anxiety_and_panic_attacks_disappear/
Anxiety,panic,"Having a hard time deciding about medical leave and needing hope for next steps of treatment. Will this ever get better? I'm losing control completely, and having constant panic attacks.",https://www.reddit.com/r/Anxiety/comments/1lks1fh/having_a_hard_time_deciding_about_medical_leave/
Anxiety,panic,Struggling through a panic attack,https://www.reddit.com/r/Anxiety/comments/1lkq0c0/struggling_through_a_panic_attack/
Anxiety,panic,Anybody know about Delta troponin levels rising after a panic attack?,https://www.reddit.com/r/Anxiety/comments/1lkmie4/anybody_know_about_delta_troponin_levels_rising/
Anxiety,panic,Recovering from panic attacks,https://www.reddit.com/r/Anxiety/comments/1lklqrv/recovering_from_panic_attacks/
Anxiety,panic,"To recover from Panic Attacks, you need to face it, they say.",https://www.reddit.com/r/Anxiety/comments/1lkj18c/to_recover_from_panic_attacks_you_need_to_face_it/
Anxiety,panic,anxiety/panic attacks,https://www.reddit.com/r/Anxiety/comments/1lkiz0j/anxietypanic_attacks/
Anxiety,panic,Is this normal after a panic attack?,https://www.reddit.com/r/Anxiety/comments/1lki3hc/is_this_normal_after_a_panic_attack/
Anxiety,lonely,I’ve been feeling really lonely today and I stumbled upon my landlord and had a casual chat which made me feel so much better afterwards.,https://www.reddit.com/r/Anxiety/comments/1ljirgd/ive_been_feeling_really_lonely_today_and_i/
Anxiety,lonely,Why do we feel lonely?,https://www.reddit.com/r/Anxiety/comments/1lca3cb/why_do_we_feel_lonely/
Anxiety,lonely,DAE feel lonely by choice?,https://www.reddit.com/r/Anxiety/comments/1laiu51/dae_feel_lonely_by_choice/
Anxiety,die,I fear I will literally die because my anxiety is stopping me from getting help,https://www.reddit.com/r/Anxiety/comments/1ljposk/i_fear_i_will_literally_die_because_my_anxiety_is/
Anxiety,numb,numbness and burning sensations,https://www.reddit.com/r/Anxiety/comments/1lkfma8/numbness_and_burning_sensations/
Anxiety,numb,Numbness/Tingling in right side of body,https://www.reddit.com/r/Anxiety/comments/1lk1wrv/numbnesstingling_in_right_side_of_body/
Anxiety,numb,Propranolol numbness,https://www.reddit.com/r/Anxiety/comments/1ljr1yi/propranolol_numbness/
Anxiety,worthless,My family members are kind of looking down at me and making me worthless,https://www.reddit.com/r/Anxiety/comments/1lkf069/my_family_members_are_kind_of_looking_down_at_me/
Anxiety,tired,"I’m tired of feeling anxious all the time, even when nothing is wrong",https://www.reddit.com/r/Anxiety/comments/1lk4gyl/im_tired_of_feeling_anxious_all_the_time_even/
Anxiety,tired,So restless and tired at the same time,https://www.reddit.com/r/Anxiety/comments/1ljlwmg/so_restless_and_tired_at_the_same_time/
Anxiety,tired,"I'm tired of being scared and worried about everything. I'm done. From now on, F*** consequences, F*** fear, F*** worry, F*** overthinking. Whatever or whoever I'm scared of, bring it on. Throw me into the F***ing fire, I don't give a damn anymore. I choose to live like this.",https://www.reddit.com/r/Anxiety/comments/1ljfnrw/im_tired_of_being_scared_and_worried_about/
Anxiety,hopeless,a hopeless rant,https://www.reddit.com/r/Anxiety/comments/1lkfmga/a_hopeless_rant/
Anxiety,hopeless,What do you do on the days where you're feeling hopeless about recovery and just exhausted from dealing with anxiety all the time?,https://www.reddit.com/r/Anxiety/comments/1ljzco1/what_do_you_do_on_the_days_where_youre_feeling/
Anxiety,shaking,"Neck starts shaking during eye contact in social interactions, please help!",https://www.reddit.com/r/Anxiety/comments/1ljrjlh/neck_starts_shaking_during_eye_contact_in_social/
Anxiety,shaking,Foot shaking,https://www.reddit.com/r/Anxiety/comments/1ljhpfy/foot_shaking/
Anxiety,scared,I’m really scared to fall asleep at night,https://www.reddit.com/r/Anxiety/comments/1lku4bl/im_really_scared_to_fall_asleep_at_night/
Anxiety,scared,I'm Anxious about A Catch-Up Dinner Tomorrow & I'm Scared I'll Get Ghosted,https://www.reddit.com/r/Anxiety/comments/1lkoph5/im_anxious_about_a_catchup_dinner_tomorrow_im/
Anxiety,scared,Starting a new job tomorrow and I'm scared,https://www.reddit.com/r/Anxiety/comments/1lkhi7q/starting_a_new_job_tomorrow_and_im_scared/
Anxiety,scared,I am scared to go to school,https://www.reddit.com/r/Anxiety/comments/1lkd03p/i_am_scared_to_go_to_school/
Anxiety,scared,Scared of Bus driving 🥲,https://www.reddit.com/r/Anxiety/comments/1lkbcia/scared_of_bus_driving/
Anxiety,scared,I’m Scared of My Father — and He Doesn’t Even Hit Me,https://www.reddit.com/r/Anxiety/comments/1lk8i1n/im_scared_of_my_father_and_he_doesnt_even_hit_me/
Anxiety,nervous,Any advice on nervousness issue?,https://www.reddit.com/r/Anxiety/comments/1lkgkab/any_advice_on_nervousness_issue/
Anxiety,nervous,Has anyone FULLY recovered from nervous system sensitization (Anxiety)?,https://www.reddit.com/r/Anxiety/comments/1ljr1vb/has_anyone_fully_recovered_from_nervous_system/
Anxiety,nervous,What fabric texture is permanently tattooed in your nervous system?,https://www.reddit.com/r/Anxiety/comments/1ljireh/what_fabric_texture_is_permanently_tattooed_in/
Anxiety,spiraling,"Muscle twitching? Spiraling, please help",https://www.reddit.com/r/Anxiety/comments/1lkbytm/muscle_twitching_spiraling_please_help/
Anxiety,spiraling,i can't stop spiraling thoughts whenever the subject of money comes up...,https://www.reddit.com/r/Anxiety/comments/1liuyzs/i_cant_stop_spiraling_thoughts_whenever_the/
Anxiety,alone,Flying alone to Spain for a month,https://www.reddit.com/r/Anxiety/comments/1lkoit8/flying_alone_to_spain_for_a_month/
Anxiety,alone,I need to know im not alone.,https://www.reddit.com/r/Anxiety/comments/1lk2sty/i_need_to_know_im_not_alone/
Anxiety,alone,"I always feel like I’m being watched, even when I know I’m alone.",https://www.reddit.com/r/Anxiety/comments/1ljw3u0/i_always_feel_like_im_being_watched_even_when_i/
Anxiety,alone,I need to feel less alone in this.,https://www.reddit.com/r/Anxiety/comments/1lj36pj/i_need_to_feel_less_alone_in_this/
Anxiety,invisible,Anyone raised in a toxic household as the “invisible child” and now struggles with anxiety?,https://www.reddit.com/r/Anxiety/comments/1le3gbn/anyone_raised_in_a_toxic_household_as_the/
Anxiety,invisible,How does it feel to be invisible?,https://www.reddit.com/r/Anxiety/comments/1kof2ju/how_does_it_feel_to_be_invisible/
Anxiety,invisible,Invisible in my own life,https://www.reddit.com/r/Anxiety/comments/1k3xwm1/invisible_in_my_own_life/
Anxiety,kill,"My Anxiety disorder's going to kill me, it's so bad it makes it feel like there's liquid in my body and itchiness in certain areas, need help trying to understand.",https://www.reddit.com/r/Anxiety/comments/1lk2gbv/my_anxiety_disorders_going_to_kill_me_its_so_bad/
Anxiety,gone,"What’s the longest you’ve gone MIA to family, friends, partner etc because of anxiety?",https://www.reddit.com/r/Anxiety/comments/1lj6jgl/whats_the_longest_youve_gone_mia_to_family/
Anxiety,disappear,Crazy how fast Anxiety and Panic attacks disappear,https://www.reddit.com/r/Anxiety/comments/1lksiz4/crazy_how_fast_anxiety_and_panic_attacks_disappear/
Anxiety,disappear,Ever had all your anxiety just disappear?,https://www.reddit.com/r/Anxiety/comments/1l9xerv/ever_had_all_your_anxiety_just_disappear/
Anxiety,over,I can no longer analyse anything without overthinking it,https://www.reddit.com/r/Anxiety/comments/1lkpw1e/i_can_no_longer_analyse_anything_without/
Anxiety,over,Really over thinking my upcoming blood work results,https://www.reddit.com/r/Anxiety/comments/1lkkmgj/really_over_thinking_my_upcoming_blood_work/
Anxiety,over,Anxiety waves over no specific reason,https://www.reddit.com/r/Anxiety/comments/1lk8hqj/anxiety_waves_over_no_specific_reason/
Anxiety,burnt,Burnt out,https://www.reddit.com/r/Anxiety/comments/1kxoku2/burnt_out/
Anxiety,burnt,DIARY OF A BURNT OUT LOSER - PART 1,https://www.reddit.com/r/Anxiety/comments/1kifjba/diary_of_a_burnt_out_loser_part_1/
Anxiety,overload,"Constant fatigue, mental overload, and disconnection from myself – does anyone else feel this way?",https://www.reddit.com/r/Anxiety/comments/1ljgqak/constant_fatigue_mental_overload_and/
Anxiety,overload,It feels like my brain overloads and I get shoved out and all I can do is grab my head and fight to try and comeback from what feels like insanity. Has anyone else experienced something similar I don't know what it is but it hurts with no pain.,https://www.reddit.com/r/Anxiety/comments/1kxb8t5/it_feels_like_my_brain_overloads_and_i_get_shoved/
