subreddit,keyword,title,url
Anxiety,shutdown,is there a way to shutdown my brain so i can sleep?,https://www.reddit.com/r/Anxiety/comments/1kp3b6b/is_there_a_way_to_shutdown_my_brain_so_i_can_sleep/
Anxiety,shutdown,Has anyone else experienced this kind of panic attack “shutdown”?,https://www.reddit.com/r/Anxiety/comments/1jq9y7n/has_anyone_else_experienced_this_kind_of_panic/
Anxiety,shutdown,I am pretty much disconnected from my own life. My brain has shutdown,https://www.reddit.com/r/Anxiety/comments/1i6be7p/i_am_pretty_much_disconnected_from_my_own_life_my/
Anxiety,shutdown,My brain has shutdown multiple times. what should I do?,https://www.reddit.com/r/Anxiety/comments/1g5u8du/my_brain_has_shutdown_multiple_times_what_should/
Anxiety,shutdown,Shutdowns and anxiety. ,https://www.reddit.com/r/Anxiety/comments/1g08kgc/shutdowns_and_anxiety/
Anxiety,shutdown,anxiety and verbal shutdowns?,https://www.reddit.com/r/Anxiety/comments/1fmu5hv/anxiety_and_verbal_shutdowns/
Anxiety,shutdown,Anxiety leads to a mental shutdown. What can I do?,https://www.reddit.com/r/Anxiety/comments/1efbv5x/anxiety_leads_to_a_mental_shutdown_what_can_i_do/
Anxiety,collapse,Anyone else having severe fear of heart attack? Like having mild chest pains and gas issues make me feel I am going to die or collapse,https://www.reddit.com/r/Anxiety/comments/1lg9boq/anyone_else_having_severe_fear_of_heart_attack/
Anxiety,done,"I'm tired of being scared and worried about everything. I'm done. From now on, F*** consequences, F*** fear, F*** worry, F*** overthinking. Whatever or whoever I'm scared of, bring it on. Throw me into the F***ing fire, I don't give a damn anymore. I choose to live like this.",https://www.reddit.com/r/Anxiety/comments/1ljfnrw/im_tired_of_being_scared_and_worried_about/
Anxiety,mute,"Anxiety and other things have morphed into a muted, dissociative state.",https://www.reddit.com/r/Anxiety/comments/1k0cnja/anxiety_and_other_things_have_morphed_into_a/
SuicideWatch,death,Will the regular passenger train hit be instant and painless death?,https://www.reddit.com/r/SuicideWatch/comments/1lksm6c/will_the_regular_passenger_train_hit_be_instant/
SuicideWatch,death,I feel death coming closer,https://www.reddit.com/r/SuicideWatch/comments/1lk9dgg/i_feel_death_coming_closer/
SuicideWatch,death,I think I have finally come in terms with my impending death,https://www.reddit.com/r/SuicideWatch/comments/1lk8jgy/i_think_i_have_finally_come_in_terms_with_my/
SuicideWatch,anxiety,Digital anxiety,https://www.reddit.com/r/SuicideWatch/comments/1lkp0jw/digital_anxiety/
SuicideWatch,anxiety,Social Anxiety and Failure,https://www.reddit.com/r/SuicideWatch/comments/1lj6v33/social_anxiety_and_failure/
SuicideWatch,suicide,Failed suicides,https://www.reddit.com/r/SuicideWatch/comments/1lkq4my/failed_suicides/
SuicideWatch,sad,"Been separated for little over two months and idk what's gonna happen I'm sad all the time, have crying spells, and PTSD I hate life and see nothing positive about it",https://www.reddit.com/r/SuicideWatch/comments/1lkuicb/been_separated_for_little_over_two_months_and_idk/
SuicideWatch,sad,My sad life,https://www.reddit.com/r/SuicideWatch/comments/1lknalo/my_sad_life/
SuicideWatch,broken,"Situations don't break me, patterns do, and I'm beyond broken",https://www.reddit.com/r/SuicideWatch/comments/1ljwkor/situations_dont_break_me_patterns_do_and_im/
SuicideWatch,broken,I'm broken down,https://www.reddit.com/r/SuicideWatch/comments/1lipsbe/im_broken_down/
SuicideWatch,dark,Dark alleys and unlit streets,https://www.reddit.com/r/SuicideWatch/comments/1lkjcbj/dark_alleys_and_unlit_streets/
SuicideWatch,dark,I’m in a dark place for the first time in years.,https://www.reddit.com/r/SuicideWatch/comments/1liv8ai/im_in_a_dark_place_for_the_first_time_in_years/
SuicideWatch,lost,im lost,https://www.reddit.com/r/SuicideWatch/comments/1lkvj60/im_lost/
SuicideWatch,lost,I have lost a grasp on my life and I'm near the end. What do I do? I put this in another sub and was hoping for some exposure.,https://www.reddit.com/r/SuicideWatch/comments/1lko4tb/i_have_lost_a_grasp_on_my_life_and_im_near_the/
SuicideWatch,exhausted,Exhausted,https://www.reddit.com/r/SuicideWatch/comments/1lkpxwb/exhausted/
SuicideWatch,exhausted,25 I need help I just don’t know how to go on i can’t I’m tired I’m exhausted of going on and trying,https://www.reddit.com/r/SuicideWatch/comments/1ljoitk/25_i_need_help_i_just_dont_know_how_to_go_on_i/
SuicideWatch,panic,Panic Syndrome for 5 years,https://www.reddit.com/r/SuicideWatch/comments/1lkorjr/panic_syndrome_for_5_years/
SuicideWatch,panic,Daily panic attacks after cheating,https://www.reddit.com/r/SuicideWatch/comments/1lh5k5w/daily_panic_attacks_after_cheating/
SuicideWatch,lonely,lonely,https://www.reddit.com/r/SuicideWatch/comments/1ljyp94/lonely/
SuicideWatch,lonely,Lonely and sad and shitty,https://www.reddit.com/r/SuicideWatch/comments/1ljkcoq/lonely_and_sad_and_shitty/
SuicideWatch,die,I feel it’s time to die,https://www.reddit.com/r/SuicideWatch/comments/1lkrb5f/i_feel_its_time_to_die/
SuicideWatch,die,I want to die,https://www.reddit.com/r/SuicideWatch/comments/1lkqjrr/i_want_to_die/
SuicideWatch,worthless,I hate all of you and I'm leaving while you have to continue your miserable worthless lives LMAO,https://www.reddit.com/r/SuicideWatch/comments/1lkp7ce/i_hate_all_of_you_and_im_leaving_while_you_have/
SuicideWatch,worthless,"I'm dying and nobody will help and I can't get hired for any job, im useless and worthless",https://www.reddit.com/r/SuicideWatch/comments/1lkmhwo/im_dying_and_nobody_will_help_and_i_cant_get/
SuicideWatch,worthless,feeling worthless,https://www.reddit.com/r/SuicideWatch/comments/1lkm7lm/feeling_worthless/
SuicideWatch,worthless,Feeling worthless,https://www.reddit.com/r/SuicideWatch/comments/1ljorby/feeling_worthless/
SuicideWatch,worthless,Im worthless and I’m going to kill myself tonight,https://www.reddit.com/r/SuicideWatch/comments/1lj1nez/im_worthless_and_im_going_to_kill_myself_tonight/
SuicideWatch,tired,I'm tired of feeling this way.,https://www.reddit.com/r/SuicideWatch/comments/1lkrkhc/im_tired_of_feeling_this_way/
SuicideWatch,tired,Tired to still fight,https://www.reddit.com/r/SuicideWatch/comments/1lkkksm/tired_to_still_fight/
SuicideWatch,hopeless,I feel completely hopeless,https://www.reddit.com/r/SuicideWatch/comments/1lkn1tc/i_feel_completely_hopeless/
SuicideWatch,hopeless,Hopeless,https://www.reddit.com/r/SuicideWatch/comments/1ljbko2/hopeless/
SuicideWatch,hopeless,i feel hopeless (vent idk),https://www.reddit.com/r/SuicideWatch/comments/1li0n6a/i_feel_hopeless_vent_idk/
SuicideWatch,hopeless,Feeling hopeless about the future,https://www.reddit.com/r/SuicideWatch/comments/1lhywqt/feeling_hopeless_about_the_future/
SuicideWatch,drained,Mentally drained,https://www.reddit.com/r/SuicideWatch/comments/1lk333q/mentally_drained/
SuicideWatch,pointless,Life’s pointless,https://www.reddit.com/r/SuicideWatch/comments/1lk61m1/lifes_pointless/
SuicideWatch,pointless,Pointless,https://www.reddit.com/r/SuicideWatch/comments/1ld2wxx/pointless/
SuicideWatch,pointless,Life is pointless and meaningless,https://www.reddit.com/r/SuicideWatch/comments/1lc04wo/life_is_pointless_and_meaningless/
SuicideWatch,pointless,Pointless delay of the inevitable,https://www.reddit.com/r/SuicideWatch/comments/1latqfj/pointless_delay_of_the_inevitable/
SuicideWatch,overwhelmed,Overwhelmed,https://www.reddit.com/r/SuicideWatch/comments/1lksrlr/overwhelmed/
SuicideWatch,overwhelmed,Im scared. and overwhelmed. thats it,https://www.reddit.com/r/SuicideWatch/comments/1lkslzt/im_scared_and_overwhelmed_thats_it/
SuicideWatch,scared,Im scared. and overwhelmed. thats it,https://www.reddit.com/r/SuicideWatch/comments/1lkslzt/im_scared_and_overwhelmed_thats_it/
SuicideWatch,scared,Why am I so scared,https://www.reddit.com/r/SuicideWatch/comments/1lklrua/why_am_i_so_scared/
SuicideWatch,scared,I'm scared,https://www.reddit.com/r/SuicideWatch/comments/1lked1z/im_scared/
SuicideWatch,worried,"I have a plan, but I'm worried about my boyfriend after",https://www.reddit.com/r/SuicideWatch/comments/1lkahok/i_have_a_plan_but_im_worried_about_my_boyfriend/
SuicideWatch,worried,Worried my friend might be attempting,https://www.reddit.com/r/SuicideWatch/comments/1ljpmej/worried_my_friend_might_be_attempting/
SuicideWatch,spiraling,Spiraling,https://www.reddit.com/r/SuicideWatch/comments/1lk3t8z/spiraling/
SuicideWatch,spiraling,Spiraling deeper,https://www.reddit.com/r/SuicideWatch/comments/1lhzf89/spiraling_deeper/
SuicideWatch,alone,please help me I’m so alone,https://www.reddit.com/r/SuicideWatch/comments/1lkrph1/please_help_me_im_so_alone/
SuicideWatch,alone,"I’m going to take a whole bottle of xanax, I deserve to be alone forever and dead",https://www.reddit.com/r/SuicideWatch/comments/1lkiw9b/im_going_to_take_a_whole_bottle_of_xanax_i/
SuicideWatch,invisible,I am invisible,https://www.reddit.com/r/SuicideWatch/comments/1lgpk1p/i_am_invisible/
SuicideWatch,invisible,I fell fucking invisible,https://www.reddit.com/r/SuicideWatch/comments/1lbnar9/i_fell_fucking_invisible/
SuicideWatch,invisible,I am invisible,https://www.reddit.com/r/SuicideWatch/comments/1l6ix8l/i_am_invisible/
SuicideWatch,unloved,Why am I so unloved?,https://www.reddit.com/r/SuicideWatch/comments/1ljxcj7/why_am_i_so_unloved/
SuicideWatch,abandoned,A friend I had known for a few days abandoned me.,https://www.reddit.com/r/SuicideWatch/comments/1lg16ke/a_friend_i_had_known_for_a_few_days_abandoned_me/
SuicideWatch,friendless,"Literally 28F virgin, friendless, suicide practice run when my stuff gets here ",https://www.reddit.com/r/SuicideWatch/comments/1i10gil/literally_28f_virgin_friendless_suicide_practice/
SuicideWatch,unnoticed,Unnoticed everywhere,https://www.reddit.com/r/SuicideWatch/comments/1k5t6ql/unnoticed_everywhere/
SuicideWatch,kill,I am going to kill myself,https://www.reddit.com/r/SuicideWatch/comments/1lkvl6q/i_am_going_to_kill_myself/
SuicideWatch,kill,I want to kill myself,https://www.reddit.com/r/SuicideWatch/comments/1lktw2k/i_want_to_kill_myself/
SuicideWatch,kill,I am going to kill myself,https://www.reddit.com/r/SuicideWatch/comments/1lkq8za/i_am_going_to_kill_myself/
SuicideWatch,kill,I might actually kill myself soon.,https://www.reddit.com/r/SuicideWatch/comments/1lkpv6j/i_might_actually_kill_myself_soon/
SuicideWatch,kill,I want to kill myself because I don't understand God's plan to find a relationship / marriage.,https://www.reddit.com/r/SuicideWatch/comments/1lkpfih/i_want_to_kill_myself_because_i_dont_understand/
SuicideWatch,gone,I’m so far gone that i can’t Even understand what Is so terrible about suicide,https://www.reddit.com/r/SuicideWatch/comments/1lkmj1t/im_so_far_gone_that_i_cant_even_understand_what/
SuicideWatch,disappear,"At work, barely functioning, just want to walk out of here and disappear",https://www.reddit.com/r/SuicideWatch/comments/1lkmn2h/at_work_barely_functioning_just_want_to_walk_out/
SuicideWatch,hurt,"Not going to hurt myself, but the thought is less absurd than it used to be recently",https://www.reddit.com/r/SuicideWatch/comments/1lkliyx/not_going_to_hurt_myself_but_the_thought_is_less/
SuicideWatch,over,"Been separated for little over two months and idk what's gonna happen I'm sad all the time, have crying spells, and PTSD I hate life and see nothing positive about it",https://www.reddit.com/r/SuicideWatch/comments/1lkuicb/been_separated_for_little_over_two_months_and_idk/
SuicideWatch,over,It's over for me,https://www.reddit.com/r/SuicideWatch/comments/1lkuhbk/its_over_for_me/
SuicideWatch,over,I will never physically or mentally overcome my unattractiveness.,https://www.reddit.com/r/SuicideWatch/comments/1lks88p/i_will_never_physically_or_mentally_overcome_my/
SuicideWatch,over,I was visibly sick from an overdose after a failed attempt.. and no one bothered to check in...,https://www.reddit.com/r/SuicideWatch/comments/1lkn3zq/i_was_visibly_sick_from_an_overdose_after_a/
SuicideWatch,end,Help me help my friend,https://www.reddit.com/r/SuicideWatch/comments/1lku9jl/help_me_help_my_friend/
SuicideWatch,overload,Can burn out and sensory and mental overload cause suicidality?,https://www.reddit.com/r/SuicideWatch/comments/1g7udwz/can_burn_out_and_sensory_and_mental_overload/
SuicideWatch,blank,Will a .22 air gun point blank kill me?,https://www.reddit.com/r/SuicideWatch/comments/1l186o9/will_a_22_air_gun_point_blank_kill_me/
SuicideWatch,shutdown,Shutdown & Broken ,https://www.reddit.com/r/SuicideWatch/comments/1fvpnga/shutdown_broken/
